{
  "id": "10000000-0000-4000-8000-000000000004",
  "workspace_id": "10000000-0000-4000-8000-000000000001",
  "project_id": "10000000-0000-4000-8000-000000000002",
  "chat_id": "10000000-0000-4000-8000-000000000003",
  "mode": "agent",
  "kind": "normal",
  "state": "running",
  "outcome": "none",
  "approval_mode": "automatic",
  "scope_version_id": null,
  "grant_id": null,
  "provider_config_id": "10000000-0000-4000-8000-000000000005",
  "worker_id": "10000000-0000-4000-8000-000000000006",
  "data_mode": "local_only",
  "limits": {
    "max_steps": 40,
    "active_timeout_seconds": 1800,
    "absolute_timeout_seconds": 86400,
    "budget_micro_usd": "2000000",
    "max_children": 2,
    "max_parallel_tools": 2,
    "max_tool_timeout_seconds": 600
  },
  "revision": 1,
  "created_at": "2026-09-24T03:00:00Z",
  "updated_at": "2026-09-24T03:00:00Z",
  "expires_at": "2026-09-25T03:00:00Z",
  "resumes_run_id": null,
  "stop_reason": null,
  "objective": "Phân tích tài liệu OpenAPI fixture offline.",
  "plan_revision": 1,
  "plan": [
    {
      "step_id": "10000000-0000-4000-8000-000000000030",
      "description": "Đọc và phân tích file đã cung cấp.",
      "state": "running",
      "tool_call_ids": []
    }
  ],
  "usage": {
    "observed_micro_usd": "0",
    "reserved_micro_usd": "0",
    "unknown_reservation_count": 0
  }
}
